,Objective Question,Original Answer,Sub Ques 1 ,Label 1,Sub Ques 2,Label 2,Sub Ques 3,Label 3,,,,,,,,,,,,,,,,,,,
286,the   party-in-government   refers to,winning candidates who become the main spokespersons for the party that nominated them,What refers to winning candidates who become the main spokespersons for the party that nominated them?,1,Does the party-in-government refer to winning candidates who become the main spokespersons for the party that nominated them?,0,,,,,,,,,,,,,,,,,,,,,
287,the risk-benefit ratio in treating schizophrenia refers to,the benefits of medication in alleviating psychotic symptoms versus the adverse effects,What does the risk-benefit ratio in treating schizophrenia refer to?,1,What refers to the benefits of medication in alleviating psychotic symptoms versus the adverse effects?,1,Does the risk-benefit ratio in treating schizophrenia refer to the benefits of medication in alleviating psychotic symptoms versus the adverse effects?,0,,,,,,,,,,,,,,,,,,,
288,most decisions handed down by the Supreme Court are cases involving,appeals from lower federal courts,What are cases involving appeals from lower federal courts?,1,What are most decisions handed down by the Supreme Court?,1,Are most decisions handed down by the Supreme Court cases involving appeals from lower federal courts?,0,,,,,,,,,,,,,,,,,,,
289,the amount of a good an individual has,affects the rate at which she is willing to trade,When has the amount of a good an individual affects at which she is willing to trade?,0,What has affects the rate at which she is willing to trade?,1,Has the amount of a good an individual affects the rate at which she is willing to trade?,0,,,,,,,,,,,,,,,,,,,
290,"mutism, self-destructive behavior, and echolalia are symptoms of",childhood autism,What are symptoms of childhood autism?,1,"What are mutism, self-destructive behavior, and echolalia symptoms of?",1,"What are mutism, self-destructive behavior, and echolalia?",0,,,,,,,,,,,,,,,,,,,
291,feudal societies are generally characterized by,an emphasis on social order,What are generally characterized by an emphasis on social order?,1,What are feudal societies generally characterized by?,1,Are feudal societies generally characterized by an emphasis on social order?,0,,,,,,,,,,,,,,,,,,,
292,Which is a characteristic of a feudal society?,rigid class structure,What is a characteristic of a feudal society?,0,What is which a characteristic of?,0,What is which?,0,,,,,,,,,,,,,,,,,,,
293,economists compute the price elasticity of demand as,percentage change in the quantity demanded divided by the percentage change in price,Who demanded divided by the percentage change in price?,1,What did economists compute the price elasticity of demand as percentage change in the quantity demand divided by?,0,Did economists compute the price elasticity of demand as percentage change in the quantity demand divided by the percentage change in price?,0,,,,,,,,,,,,,,,,,,,
294,a set of rules for structuring sentences is called,grammar,What is a set of rules for structuring sentences called?,1,What is called grammar?,1,Is a set of rules for structuring sentences called grammar?,0,,,,,,,,,,,,,,,,,,,
295,A constitution? What for? The Koran is the oldest and most efficient constitution in the world.   --King Faisal of Saudi Arabia (1966),the laws of Islam can be used to govern a country,What is the oldest and most efficient constitution in the world?,1,What is the Koran?,1,Is the Koran the oldest and most efficient constitution in the world?,0,,,,,,,,,,,,,,,,,,,
296,"one similarity in the leadership of Kemal Ataturk, Gamal Nasser, and Shah Reza Pahlavi is that all these leaders",sought to modernize their nations,"What is one similarity in the leadership of Kemal Ataturk, Gamal Nasser, and Shah Reza Pahlavi?",0,"What is one similarity in the leadership of Kemal Ataturk, Gamal Nasser, and Shah Reza Pahlavi that all these leaders sought to modernize?",1,What is that all these leaders sought to modernize their nations?,0,,,,,,,,,,,,,,,,,,,
297,a main idea of Karl Marx and Friedrich Engles  Communist Manifesto is that the proletariat,must unite to overthrow the capitalist class,What is a main idea of Karl Marx and Friedrich Engles Communist Manifesto that the proletariat must unite to overthrow?,0,What is that the proletariat must unite to overthrow the capitalist class?,0,What is a main idea of Karl Marx and Friedrich Engles Communist Manifesto?,1,,,,,,,,,,,,,,,,,,,
298,Which sensory receptor is found in greatest numbers in the skin?,pain receptors,,0,,0,,0,,,,,,,,,,,,,,,,,,,
299,The Zionist movement primarily desired to?,create a Jewish homeland in Palestine,What primarily desired to?,0,Did the Zionist movement primarily desire to?,0,,,,,,,,,,,,,,,,,,,,,
300,muscles can contract because they are made up of,effector cells,What can contract because they are made up of effector cells?,1,What are made up of effector cells?,1,What are muscles made up of?,1,,,,,,,,,,,,,,,,,,,
301,girls who mature early are more likely,to engage in earlier sexual relations,Who are more likely to engage in earlier sexual relations?,1,Are girls who mature early more likely to engage in earlier sexual relations?,0,,,,,,,,,,,,,,,,,,,,,
302,a binding price ceiling will make it necessary to,"develop a way of rationing the product, because there will be a shortage",What will make it necessary to develop a way of rationing the product?,1,Will a binding price ceiling make it necessary to develop a way of rationing the product?,0,What will a binding price ceiling make necessary to develop a way of rationing the product?,0,,,,,,,,,,,,,,,,,,,
303,carl Rogers is responsible for,client-centered therapy,Who is responsible for client-centered therapy?,1,What is Carl Rogers responsible for?,1,Is Carl Rogers responsible for client-centered therapy?,0,,,,,,,,,,,,,,,,,,,
304,A person is asked to decide on a major in school; another is asked to decide on a career. We may say that the different answers they give to broad and specific questions are because of,differences in framing,Who is asked to decide on a major in school?,0,What is asked to decide on a career?,0,Is a person asked to decide on a major in school?,0,,,,,,,,,,,,,,,,,,,
305,"according the teachings of Confucius, the key to the successful organization of society is that",individuals should know and do what is expected of them,What is that individuals should know and do what is expected of the teachings of Confucius according the teachings of Confucius?,0,What is the key to the successful organization of society that individuals should know and do what is expected of the teachings of Confucius?,0,What is the key to the successful organization of society of according the teachings of Confucius?,1,,,,,,,,,,,,,,,,,,,
306,"in hunger, a set point is",related to the proportion of body fat your body normally maintains,,0,,0,,0,,,,,,,,,,,,,,,,,,,
307,"during the 18th and 19th centuries, Europeans improved roads and bridges and built railroads in their colonies primarily to",obtain raw materials needed for industrialization,Who built railroads in their colonies primarily to obtain raw materials needed for industrialization?,1,What do Europeans build in their colonies primarily to obtain raw materials needed for industrialization?,0,What do Europeans build railroads in their colonies primarily to obtain?,0,,,,,,,,,,,,,,,,,,,
308,"for Freud, the time during which psychosexual development is interrupted is called the",latency period,When is the time during which psychosexual development is interrupted called for Freud?,0,Who is the time during which psychosexual development is interrupted called the latency period for?,0,When is called the latency period for Freud?,1,,,,,,,,,,,,,,,,,,,
309,psychologist Wolfgang Köhler believed that the solution of a multiple-stick problem in chimpanzees revealed,a capacity for insight,What did psychologist Wolfgang Kohler believe that the solution of a multiple-stick problem in chimpanzees revealed?,1,Who believed that the solution of a multiple-stick problem in chimpanzees revealed a capacity for insight?,0,What did psychologist Wolfgang Kohler believe?,1,,,,,,,,,,,,,,,,,,,
310,"during the 1980 s, the Soviet Union experimented with modifications of its command economy by",introducing some market economy strategies,What did the Soviet Union experiment with modifications of its command economy by introducing some market economy strategies during?,0,What experimented with modifications of its command economy by introducing some market economy strategies during the 1980 s?,0,What did the Soviet Union experiment with by introducing some market economy strategies during the 1980 s?,1,,,,,,,,,,,,,,,,,,,
311,"The proletarians have nothing to lose but their chains Workers of the world, unite!",Industrial Revolution,Who have nothing to lose but their chains Workers of the world!,1,What do the proletarians have!,0,Do the proletarians have nothing to lose but their chains Workers of the world!,0,,,,,,,,,,,,,,,,,,,
312,the surge in President George Bush's approval ratings during and immediately following theGulf War in 1991 was an example of,a rally event,What was an example of a rally event?,1,What was the surge in President George Bush's approval ratings during and immediately following theGulf War in 1991?,0,What was the surge in President George Bush's approval ratings during and immediately following theGulf War in 1991 an example of?,1,,,,,,,,,,,,,,,,,,,
313,litigants are,the plaintiff and the defendant,Who are the plaintiff and the defendant?,1,Who are litigants?,1,Are litigants the plaintiff and the defendant?,0,,,,,,,,,,,,,,,,,,,
314,"in Dred Scott v. Sandford (1857), Chief Justice Taney declared that",Congress had no authority to ban slavery in the territories,Who declared that Congress had no authority to ban slavery in the territories in Dred Scott v. Sandford?,1,Who did Chief Justice Taney declare that Congress had no authority to ban slavery in the territories in?,0,What did Chief Justice Taney declare that Congress had in Dred Scott v. Sandford?,0,,,,,,,,,,,,,,,,,,,
315,keynes believed that economies experiencing high unemployment should adopt policies to,increase aggregate demand,Who believed that economies experiencing high unemployment should adopt policies to increase aggregate demand?,1,What did keynes believe that economies experiencing high unemployment should adopt to increase aggregate demand?,0,What did keynes believe that economies experiencing high unemployment should adopt policies to increase?,0,,,,,,,,,,,,,,,,,,,
316,the Constitution framers,generally wanted a president with limited authority and responsibilities,Who did the Constitution framers generally want with limited authority and responsibilities?,0,Who generally wanted a president with limited authority and responsibilities?,1,What did the Constitution framers generally want a president with?,0,,,,,,,,,,,,,,,,,,,
317,"""Flashbulb"" memories, which are vivid, lasting images of events associated with personal tragedy, may be produced in part by",increased secretion of the hormone ACTH,"What are vivid, lasting images of events associated with personal tragedy?",0,"What are ``Flashbulb'' memories vivid, lasting images of?",1,What may ``Flashbulb'' memories be produced in part by?,0,,,,,,,,,,,,,,,,,,,
318,the amount of carbon dioxide in the atmosphere has increased in recent years.  Environmentalists suggest this change is a direct result of the,overcutting of forests and the increased use of fossil fuels,When has the amount of carbon dioxide in the atmosphere increased?,0,What do Environmentalists suggest is a direct result of the overcutting of forests and the increased use of fossil fuels?,1,What do Environmentalists suggest?,0,,,,,,,,,,,,,,,,,,,
319,classifying things as absolutely right or wrong typifies,good-bad or all or nothing thinking,,0,,0,,0,,,,,,,,,,,,,,,,,,,
320,Why do Hindus believe it is important to follow the path of non-violence?,all people and things are aspects of Brahman and should be respected,What are aspects of Brahman?,0,Who are all people and things aspects of?,0,What are all people and things?,0,,,,,,,,,,,,,,,,,,,
321,"Which type of store is much larger than regular supermarkets and offers a large assortment of routinely purchased food products, nonfood items, and services?",superstore,,0,,0,,0,,,,,,,,,,,,,,,,,,,
322,increasing the minimum wage would increase,"structural unemployment, but not frictional unemployment",,,,,,,,,,,,,,,,,,,,,,,,,
323,Footbinding was primarily practiced on?,"elite, upper class women",Who was primarily practiced on?,0,Was footbinding primarily practiced on?,0,,,,,,,,,,,,,,,,,,,,,
324,"in a study of punishment, shock is administered to a hamster through a wire grid on the bottom of the cage. To the researcher's surprise, the hamster learns to roll on its back when shocked so that its fur insulates it from the shock. The hamster's response demonstrates",negative reinforcement,Where is shock administered to a hamster through a wire grid in a study of punishment?,1,What is shock administered to a hamster through a wire grid on in a study of punishment?,0,What is shock administered to a hamster through a wire grid on the bottom of the cage in?,0,,,,,,,,,,,,,,,,,,,
325,Which stage in the PLC is characterized by rapid market acceptance and increasing sales?,growth,,0,,0,,0,,,,,,,,,,,,,,,,,,,
326,"from as early as I can remember, the Emperor was an important presence even in our remote home.  He was a descendant of the gods from thousands of years before, never to be looked at or listened to by mere mortals, a presence to be revered and protected and obeyed Finally , my family and neighbors gathered around the radio and listened in stunned silence to the voice that had never before been heard, saying he was only human after all.  Everyone was crying.  I was sad and confused",defeat of the Japanese in World War II,Who was I sad and confused defeat of in World War II?,0,Who was sad and confused defeat of the Japanese in World War II?,0,What was I sad and confused defeat of the Japanese in?,0,,,,,,,,,,,,,,,,,,,
327,an authorization bill,"establishes, continues, or changes a discretionary program or an entitlement","What establishes, continues, or changes a discretionary program or an entitlement?",1,,,,,,,,,,,,,,,,,,,,,,,
328,the soma is the part of the nerve cell that,collects and combines incoming information,What is the part of the nerve cell that collects and combines incoming information?,1,What is the soma the part of that collects and combines incoming information?,0,What is the soma?,1,,,,,,,,,,,,,,,,,,,
329,"Of the four Arab-Israeli wars fought since 1948, Jewish forces have won?",all,What have won of the four Arab-Israeli wars fought since 1948?,0,What have jewish forces won of?,0,Have jewish forces won of the four Arab-Israeli wars fought since 1948?,0,,,,,,,,,,,,,,,,,,,
330,the purchase price of land is,the price a person pays to own the factor of production,,0,,0,,0,,,,,,,,,,,,,,,,,,,
331,"Consider the following two sentences. Although the Volcker disinflation came at the cost of high unemployment, the cost was less than most economists predicted. The cost of the disinflation might have been even greater if people had believed that Volcker would really reduce inflation as much as he did",Only the first sentence is true,What might have been even greater if people had believed that Volcker would really reduce inflation as much as he did Only the first sentence is true?,0,What came at the cost of high unemployment?,0,What did the Volcker disinflation come at?,1,,,,,,,,,,,,,,,,,,,
332,americans are usually least interested in,foreign policy,Who are usually least interested in foreign policy?,1,What are americans usually least interested in?,1,Are americans usually least interested in foreign policy?,0,,,,,,,,,,,,,,,,,,,
333,in the long run a higher savings rate leads to,"A and B, but not C","When leads to A and B, but not C in the long run?",0,"When does a higher savings rate lead to A and B, but not C?",0,What does a higher savings rate lead to in the long run?,1,,,,,,,,,,,,,,,,,,,
334,"to be confident that a cause-and-effect relationship exists, it is necessary to",perform a controlled experiment,What is necessary to perform a controlled experiment?,0,Is a cause-and-effect relationship necessary to perform a controlled experiment?,0,Is it necessary to perform a controlled experiment?,0,,,,,,,,,,,,,,,,,,,
335,Which was an immediate result of the European Age of Exploration?,European influence spread to the Western hemisphere,What was an immediate result of the European Age of Exploration?,1,Who was which an immediate result of?,1,Where did european influence spread?,0,,,,,,,,,,,,,,,,,,,
336,there is a strong relationship between dating frequency and physical attractiveness,for females,,0,,0,,0,,,,,,,,,,,,,,,,,,,
337,"according to political scientist Gary Jacobson's research, a Congressional incumbent whospends a tremendous amount of money to get reelected",is more likely to lose,Who is political scientist Gary Jacobson's research?,0,Who is a Congressional incumbent whospends?,0,Is political scientist Gary Jacobson's research a Congressional incumbent whospends?,0,,,,,,,,,,,,,,,,,,,
338,"brad, a U.S. resident, builds and operates a boxing gym in Thailand. The purchase represents",investment for Brad and U.S. foreign direct investment,What represents investment for Brad and U. S. foreign direct investment?,1,What is a U. S. resident?,0,What does the purchase represent?,0,,,,,,,,,,,,,,,,,,,
339,the ratio of what a country pays for imports to what it earns in exports is known as its,balance of trade,What is the ratio of what a country pays for imports to what it earns in exports known as?,0,What is known as its balance of trade?,1,Is the ratio of what a country pays for imports to what it earns in exports known as its balance of trade?,0,,,,,,,,,,,,,,,,,,,
340,"in cooperative federalism, in order to qualify for federal grant money, cities and states must",follow federal guidelines for adopting and enforcing federal laws,What must cities and states follow federal guidelines for enforcing federal laws in cooperative federalism in?,0,What must cities and states follow for enforcing federal laws in cooperative federalism in order to qualify for federal grant money?,0,What must follow federal guidelines for enforcing federal laws in cooperative federalism in order to qualify for federal grant money?,1,,,,,,,,,,,,,,,,,,,
341,"Suppose that an increase in the price of carrots from $1.20 to $1.40 per pound raises the amount of carrots that carrot farmers are willing to supply from 1.2 million pounds to 1.6 million pounds. Using the midpoint method, what would be the elasticity of supply?",1.86,What would be the elasticity of supply?,0,What would what be the elasticity of?,0,What would what be?,0,,,,,,,,,,,,,,,,,,,
342,the political resource that has the most potential to turn a situation of stalemate between thepresident and Congress into one supportive of the president's legislative proposals is,public approval,What is public approval?,1,What is the political resource that has the most potential to turn a situation of stalemate between thepresident and Congress into one supportive of the president's legislative proposals?,1,,,,,,,,,,,,,,,,,,,,,
343,Which statement about the problems of Indian independence is a fact rather than an opinion?,Muslim leaders wanted their own separate Muslim state,Who wanted their own separate Muslim state?,1,What did muslim leaders want?,0,Did muslim leaders want their own separate Muslim state?,0,,,,,,,,,,,,,,,,,,,
344,"In Confucian thought, the ruler-subject relationship was modeled after?",the father-son relationship,What was modeled after in Confucian thought?,0,What was the ruler-subject relationship modeled after in?,1,Was the ruler-subject relationship modeled after in Confucian thought?,0,,,,,,,,,,,,,,,,,,,
345,The movement of peoples across the Fertile Crescent resulted in the?,constant exchange of ideas,What did the movement of peoples across the Fertile Crescent result in?,1,What resulted in the?,0,Did the movement of peoples across the Fertile Crescent result in the?,0,,,,,,,,,,,,,,,,,,,
346,if the allocation of power under dual federalism were compared to a cake it would be mostlike,"a layer cake, with two distinct layers",,0,,0,,0,,,,,,,,,,,,,,,,,,,
347,the primary goal of the American Revolution was,to restore the colonists ¹ rights as British subjects,What was to restore the colonists rights as British subjects?,1,Was the primary goal of the American Revolution to restore the colonists rights as British subjects?,0,,,,,,,,,,,,,,,,,,,,,
348,the Very First Thing You Should Know About South African Stocks and Bonds     Two Leading Financial Institutions Show You Around South Africa s Banking World,a renewed interest in investing in South Africa s economy,,0,,0,,0,,,,,,,,,,,,,,,,,,,
349,"The Canal was dug by Egypt s sons and 120,000 of them died while working.  The Suez Canal Company in Paris is an imposter company.  It usurped our concessions  Therefore, I have signed today the following law which has been approved by the Cabinet Article 1 of the decree reads,  The Universal Company of the Suez Maritime Canal Egyptian Joint-Stock Company   is hereby nationalized. All its assets, rights and obligations are hereby transferred to the Nation",take control of the Suez Canal,What is the Suez Canal Company in Paris?,0,What are hereby transferred to the Nation take control of the Suez Canal?,0,What was dug by Egypt s sons?,0,,,,,,,,,,,,,,,,,,,
350,"it is important for a mother to breast feed her baby, as it",appears to aid in attachment,What is important for a mother to breast feed her baby?,1,Who is it important for to breast feed her baby?,0,What does it appear to aid in?,0,,,,,,,,,,,,,,,,,,,
351,the modernization of Japan during the Meiji Restoration resulted in,the rise of Japan as an imperialistic nation,What resulted in the rise of Japan as an imperialistic nation?,1,What did the modernization of Japan during the Meiji Restoration result in as an imperialistic nation?,0,What did the modernization of Japan during the Meiji Restoration result in the rise of Japan as?,0,,,,,,,,,,,,,,,,,,,
352,the legislation passed by Congress in 1890 to reduce the market power of large and powerful “trusts” is called the,Sherman Act,What is called the Sherman Act?,1,What is the legislation passed by Congress in 1890 to reduce the market power of large and powerful ``trusts'' called?,1,Is the legislation passed by Congress in 1890 to reduce the market power of large and powerful ``trusts'' called the Sherman Act?,0,,,,,,,,,,,,,,,,,,,
353,opposition to Civil Rights laws for the handicapped has been justified primarily on the basisof the,high cost of programs to help the disabled,What has been justified primarily on the basisof the high cost of programs to help the disabled?,1,What has opposition to Civil Rights laws for the handicapped been justified primarily on the basisof to help the disabled?,0,What has opposition to Civil Rights laws for the handicapped been justified primarily on the high cost of programs to help the disabled?,0,,,,,,,,,,,,,,,,,,,
354,conversion disorder and hypochondriasis are classified as,somatoform disorders,What are conversion disorder and hypochondriasis classified as?,1,What are classified as somatoform disorders?,1,Are conversion disorder and hypochondriasis classified as somatoform disorders?,0,,,,,,,,,,,,,,,,,,,
355,fifth Amendment rights were expanded to include guidelines for police interrogationprocedures in the famous case of,Miranda v. Arizona,What were expanded to include guidelines for police interrogationprocedures in the famous case of Miranda v. Arizona?,1,Were fifth Amendment rights expanded to include guidelines for police interrogationprocedures in the famous case of Miranda v. Arizona?,0,,,,,,,,,,,,,,,,,,,,,
356,the chief antidote for test anxiety is,overpreparation,What is overpreparation?,1,Is the chief antidote for test anxiety overpreparation?,0,,,,,,,,,,,,,,,,,,,,,
357,"Based on data from 1998, what percent of all income in the United States did the top fifth of all families receive?",47 percent,,0,,0,,,,,,,,,,,,,,,,,,,,,
358,Hewlett-Packard's Customer Sales Group caused frustration among customers and salespeople. What was the primary problem with the sales force structure of CSG?,Salespeople were responsible for selling all H-P products instead of specializing in a few products,What Group caused frustration among customers and salespeople?,1,What did Hewlett-Packard's Customer Sales Group cause?,1,Who were responsible for selling all H-P products instead of specializing in a few products?,0,,,,,,,,,,,,,,,,,,,
359,"in Latin America, the Maya and the Aztec civilizations were similar in that they",developed complex mathematical and calendar systems,Where were the Maya and the Aztec civilizations similar in that they developed complex mathematical and calendar systems?,0,Who were similar in that they developed complex mathematical and calendar systems in Latin America?,1,What were the Maya and the Aztec civilizations similar in that they developed complex mathematical and calendar systems in?,0,,,,,,,,,,,,,,,,,,,
360,an orange grower in Florida who loses most of his orange trees to a hard freeze should expect the marginal productivity of his capital to,decrease,What should an orange grower in Florida who loses most of his orange trees to a hard freeze expect the marginal productivity of?,0,What should expect the marginal productivity of his capital to decrease?,0,What should an orange grower in Florida who loses most of his orange trees to a hard freeze expect?,1,,,,,,,,,,,,,,,,,,,
