,Objective Question,Original Answer,Sub Ques 1 ,Label 1,Sub Ques 2,Label 2,Sub Ques 3,Label 3,,,,,,,,,,,,,,,,,,,
213,"a psychosis arising from an advanced stage of syphilis, in which the disease attacks brain cells, is called",general paresis,What is called general paresis?,1,"What is a psychosis arising from an advanced stage of syphilis, in which the disease attacks brain cells called?",1,"Is a psychosis arising from an advanced stage of syphilis, in which the disease attacks brain cells called general paresis?",0,,,,,,,,,,,,,,,,,,,
214,"in addition to providing water for Indian agriculture, the Ganges River remains important to India because it is",a sacred river for the Hindu population,Where does the Ganges River remain important because it is a sacred river for the Hindu population in addition to providing water for Indian agriculture?,0,What does the Ganges River remain important to because it is a sacred river for the Hindu population in addition to providing water for Indian agriculture?,0,What remains important to India because it is a sacred river for the Hindu population in addition to providing water for Indian agriculture?,1,,,,,,,,,,,,,,,,,,,
215,A social reform of the Meiji Restoration was to?,make everyone equal before the law,Was a social reform of the Meiji Restoration to?,0,What was to?,0,,,,,,,,,,,,,,,,,,,,,
216,one result of the Neolithic Revolution was,the establishment of villages and the rise of governments,What was the establishment of villages and the rise of governments?,0,What was one result of the Neolithic Revolution?,1,Was one result of the Neolithic Revolution the establishment of villages and the rise of governments?,0,,,,,,,,,,,,,,,,,,,
217,at the optimum,the slope of the indifference curve is equal to the slope of the budget constraint,What is equal to the slope of the budget constraint at the optimum the slope of the indifference?,0,What is curve equal to at the optimum the slope of the indifference?,0,What is curve equal to the slope of the budget constraint at?,0,,,,,,,,,,,,,,,,,,,
218,The Chinese believed a ruler kept the Mandate of Heaven by?,governing wisely,What did the Chinese believe kept the Mandate of Heaven by?,0,What believed a ruler kept the Mandate of Heaven by?,0,What did the Chinese believe a ruler kept the Mandate of by?,1,,,,,,,,,,,,,,,,,,,
219,"if the price of televisions falls, the value of the marginal product of workers making televisions will",definitely fall,"If the price of televisions falls, what will definitely fall?",1,"If the price of televisions falls, will the value of the marginal product of workers making televisions definitely fall?",0,,,,,,,,,,,,,,,,,,,,,
220,"Unlike the Delhi sultans, Akbar believed in?",religiouis freedom,Who believed in unlike the Delhi sultans?,0,Who did Akbar believe in unlike?,0,Did Akbar believe in unlike the Delhi sultans?,0,,,,,,,,,,,,,,,,,,,
221,economists are skeptical that discrimination is employer driven because,All of the above are reasons,Who are skeptical that discrimination is employer driven because All of the above are reasons?,0,What are all of the above?,0,What are reasons?,0,,,,,,,,,,,,,,,,,,,
222,extensive study of dreams indicates that,most dreams are extensions of everyday experience,When does extensive study of dreams indicate that most dreams are?,0,What indicates that most dreams are extensions of everyday experience?,1,What does extensive study of dreams indicate that most dreams are extensions of?,1,,,,,,,,,,,,,,,,,,,
223,the Virginia and New Jersey Plans introduced at the Constitutional Convention differedmainly over whether,states should send equal numbers of representatives to Congress,What Plans introduced at the Constitutional Convention differedmainly over whether states should send equal numbers of representatives to Congress?,0,What does the Virginia and New Jersey plan introduced at differedmainly over whether states should send equal numbers of representatives to Congress?,0,Does the Virginia and New Jersey plan introduced at the Constitutional Convention differedmainly over whether states should send equal numbers of representatives to Congress?,0,,,,,,,,,,,,,,,,,,,
224,"In a free market system, what is the mechanism for rationing scarce resources?",prices,What is the mechanism for rationing scarce resources in a free market system?,1,What is what the mechanism for rationing scarce resources in?,0,What is what in a free market system?,0,,,,,,,,,,,,,,,,,,,
225,excessive daytime sleepiness is a condition called,hypersomnia,What is a condition called hypersomnia?,1,What is excessive daytime sleepiness?,1,Is excessive daytime sleepiness a condition called hypersomnia?,0,,,,,,,,,,,,,,,,,,,
226,"according to the   three-headed political giant   model of political parties, the largestcomponent of an American party is the",party-in-the-electorate,What is the largestcomponent of an American party?,0,What is the party-in-the-electorate?,0,Is the largestcomponent of an American party the party-in-the-electorate?,0,,,,,,,,,,,,,,,,,,,
227,Confucius believed that a good society was one that?,preserved peace and order,Who believed that a good society was one that?,0,What did confucius believe that a good society was?,1,What did confucius believe?,0,,,,,,,,,,,,,,,,,,,
228,the major problem with using hypnosis in police work is,the occurrence of false memories,What is the major problem with using hypnosis in police work?,1,What is the major problem with using hypnosis in police work the occurrence of?,0,What is the occurrence of false memories?,0,,,,,,,,,,,,,,,,,,,
229,The Unites States originally pursued a   decapitation   strategy for confronting al -Qaida. Whatdid this strategy propose to do?,eliminate a small number of al-Qaida leaders,What originally pursued a decapitation strategy for confronting al- Qaida?,0,What did the Unites States originally pursue for confronting al- Qaida?,1,Did the Unites States originally pursue a decapitation strategy for confronting al- Qaida?,0,,,,,,,,,,,,,,,,,,,
230,"the life-cycle theory would suggest that because people can borrow and save to smooth out changes in income, their standard of living depends more on",lifetime income rather than annual income,What can save to smooth out changes in income?,0,What can people save to smooth out?,0,What would the life-cycle theory suggest on?,0,,,,,,,,,,,,,,,,,,,
231,"in our federal system, the powers of the state governments are ultimately granted by",the United States Constitution,What are the powers of the state governments ultimately granted by the United States Constitution in?,0,What are ultimately granted by the United States Constitution in our federal system?,1,What are the powers of the state governments ultimately granted by in our federal system?,0,,,,,,,,,,,,,,,,,,,
232,an exit poll is taken,"on election day, by interviewing voters as they leave the polling place",What is taken on election day?,0,When is an exit poll taken?,1,Who leave the polling place?,0,,,,,,,,,,,,,,,,,,,
233,"When a country becomes an exporter of a good,",the gains of the winners exceed the losses of the losers,Who do the gains of the winners exceed the losses of?,0,What do the gains of the winners exceed?,0,What exceed the losses of the losers?,0,,,,,,,,,,,,,,,,,,,
234,Which factor has contributed most to the social and cultural identity of the Middle East?,strong influence of Islam on the region,,,,,,,,,,,,,,,,,,,,,,,,,
235,self-actualization refers to,anyone who is making full use of his or her potentials,What refers to anyone who is making full use of his or her potentials?,1,What does self-actualization refer to?,1,Does self-actualization refer to anyone who is making full use of his or her potentials?,0,,,,,,,,,,,,,,,,,,,
236,"during the 1980 s, Mikhail Gorbachev introduced Perestroika in the Soviet Union to",improve the economy and decentralize decision making,Where did Mikhail Gorbachev introduce Perestroika to improve the economy and decentralize decision making during the 1980 s?,1,Who introduced Perestroika in the Soviet Union to improve the economy and decentralize decision making during the 1980 s?,1,What did Mikhail Gorbachev introduce Perestroika in to improve the economy and decentralize decision making during the 1980 s?,0,,,,,,,,,,,,,,,,,,,
237,critical elections   always result in the,formation of new coalitions for each political party,What always result in the formation of new coalitions for each political party?,1,What do critical elections always result in?,1,Do critical elections always result in the formation of new coalitions for each political party?,0,,,,,,,,,,,,,,,,,,,
238,In what type of buying situation would a seller most likely send only a catalog to the buyer during the proposal solicitation stage of the business buying process?,straight rebuy,When type of buying situation would a seller most likely send only a catalog to the buyer in what?,0,Who type of buying situation would to in what?,0,What would a seller most likely send only a catalog to the buyer during the proposal solicitation stage of the business buying process in what?,0,,,,,,,,,,,,,,,,,,,
239,"a beekeeper places his hives of bees in an orchard so that the bees can gather nectar to produce honey. As a result, the bees pollinate the orchard which increases the yield of fruit and also causes",positive externalities that benefit both the beekeeper and the orchard owner,Who places his hives of bees in an orchard so that the bees can gather nectar to produce honey?,0,What pollinate the orchard which increases the yield of fruit and also causes positive externalities that benefit both the beekeeper and the orchard owner as a result?,1,What does a beekeeper place his hives of bees in so that the bees can gather nectar to produce honey?,0,,,,,,,,,,,,,,,,,,,
240,the independent variable in an experiment is,the variable that the experimenter chooses to manipulate,What is the independent variable in an experiment that the experimenter chooses to manipulate?,0,What is the variable that the experimenter chooses to manipulate?,1,What is the independent variable in an experiment the variable?,0,,,,,,,,,,,,,,,,,,,
241,the number of families living in poverty in the U.S. tends to be overstated by about,10 percent,What tends to be overstated by about 10 percent?,1,What does the number of families living in poverty in the U. S. tend to be overstated by?,0,Does the number of families living in poverty in the U. S. tend to be overstated by about 10 percent?,0,,,,,,,,,,,,,,,,,,,
242,councils of Governments have been formed to,improve cooperation between local governments,What have been formed to improve cooperation between local governments?,1,Have councils of Governments been formed to improve cooperation between local governments?,0,,,,,,,,,,,,,,,,,,,,,
243,as we move from lower to higher animals a larger proportion of the brain is devoted to,the cerebrum,,0,,0,,0,,,,,,,,,,,,,,,,,,,
244,"It has impoverished the dumb millions by a system of progressive exploitation....It has reduced us politically to serfdom. It has sapped the foundation of our culture...and degraded us spiritually. --- Mohandas K. Gandhi, 1930. In the statement, the it referred to by Gandhi is?",British imperialism in India,When referred to by Gandhi is in the statement?,0,What did 1930 refer to by Gandhi is in?,0,Who did 1930 refer to by is in the statement?,0,,,,,,,,,,,,,,,,,,,
245,"Unlike China during the Age of European Imperialism, Japan?",modernized rapidly,,0,,0,,0,,,,,,,,,,,,,,,,,,,
246,the fact that many people don't know which way Lincoln is facing on the penny is probably due to,encoding failure,Is the fact that many people do not know which way Lincoln is facing on the penny probably due to encoding failure?,0,What is probably due to encoding failure?,1,,,,,,,,,,,,,,,,,,,,,
247,"During the Renaissance, which development contributed most to the Protestant Reformation?",questioning of traditional authority,What contributed most to the Protestant Reformation during the Renaissance?,1,When did development contribute most to the Protestant Reformation?,0,What did development contribute most to during the Renaissance?,1,,,,,,,,,,,,,,,,,,,
248,"in terms of critical thinking and testing, results should",be meta-analytical,What should be meta-analytical in terms of critical thinking and testing?,1,What should results be meta-analytical in?,1,Should results be meta-analytical in terms of critical thinking and testing?,0,,,,,,,,,,,,,,,,,,,
249,"You are walking into a store when a man rudely cuts in front of you, almost shoving you, so that he may enter the store first. ""What a jerk!"" you think to yourself. As you enter the store, you see the same man performing an emergency tracheotomy on a women with a collapsed windpipe. You have just",made the fundamental attribution error,Who sees the same man performing an emergency tracheotomy on a women with a collapsed windpipe?,0,"Who is walking into a store when a man rudely cuts in front of you, almost shoving you?",0,"What you are walking into when a man rudely cuts in front of you, almost shoving you?",0,,,,,,,,,,,,,,,,,,,
250,Which statement BEST describes the effects of the geography of Africa?,it has hindered economic development on the continent,What has hindered economic development on the continent?,1,What has the geography of Africa hindered?,1,Has the geography of Africa hindered economic development on the continent?,0,,,,,,,,,,,,,,,,,,,
251,a legal minimum price at which a good can be sold is a price,floor,What is a legal minimum price at which a good can be sold?,1,What is a price floor?,1,Is a legal minimum price at which a good can be sold a price floor?,0,,,,,,,,,,,,,,,,,,,
252,the most common explanation for Social Security payments accounting for a larger share of federal government expenditures is,increases in life expectancy,What is the most common explanation for Social Security payments accounting for a larger share of federal government expenditures?,1,What is increases in life expectancy?,0,Is the most common explanation for Social Security payments accounting for a larger share of federal government expenditures increases in life expectancy?,0,,,,,,,,,,,,,,,,,,,
253,"for a consumer, any point on the same indifference curve yields",the same level of satisfaction,What yields the same level of satisfaction for a consumer?,1,What does any point on the same indifference curve yield for a consumer?,1,Who does any point on the same indifference curve yield the same level of satisfaction for?,1,,,,,,,,,,,,,,,,,,,
254,if the stock market booms household spending,"increases. To offset the effects of this on the price level and real GDP, the Fed would decrease the money supply",What would the Fed decrease?,0,If the stock market booms what increases?,1,Who would decrease the money supply?,1,,,,,,,,,,,,,,,,,,,
255,eidetic imagery is found more often in,children than in adults,Who is eidetic imagery found more often in than in adults?,1,What is found more often in children than in adults?,1,Is eidetic imagery found more often in children than in adults?,0,,,,,,,,,,,,,,,,,,,
256,Which statement about the Fertile Crescent is accurate?,"rich soil and abundant water, especially in the Tigris-Euphrates Valley made it a center of early civilization",What made it a center of early civilization?,0,Did rich soil and abundant water make it a center of early civilization?,0,,,,,,,,,,,,,,,,,,,,,
257,"in China, the Great Leap Forward and the Cultural Revolution promoted by Mao Zedong were similar in that both plans",disrupted industrial development,Who were similar in that both plans disrupted industrial development in China?,0,Where were the Great Leap Forward and the Cultural Revolution promoted by Mao Zedong similar in that both plans disrupted industrial development?,0,What were the Great Leap Forward and the Cultural Revolution promoted by Mao Zedong similar in that both plans disrupted industrial development in?,0,,,,,,,,,,,,,,,,,,,
258,"according to public opinion polls, presidents seem to be most popular",when they first enter office,Who seem to be most popular when they first enter office?,1,Do presidents seem to be most popular when they first enter office?,0,,,,,,,,,,,,,,,,,,,,,
259,one of the limitations of the case study is that,there are no control groups,What is that there are no control groups?,0,What is one of the limitations of the case study that there are?,0,What is one of the limitations of the case study?,1,,,,,,,,,,,,,,,,,,,
260,the Fourteenth Amendment was one of three passed,directly following the Civil War,What was one of three passed directly following the Civil War?,1,What was the Fourteenth Amendment?,1,What was the Fourteenth Amendment one of?,0,,,,,,,,,,,,,,,,,,,
261,"When people vote according to the nature of the times,",they are more interested in results than ideology and judge presidents by results,What are more interested in results than ideology and judge presidents by results?,0,What are people more interested in results than ideology and judge presidents by?,0,What are people more interested in results than by results?,0,,,,,,,,,,,,,,,,,,,
262,"in his classic studies of conformity, Asch demonstrated that",lack of unanimity greatly reduces the pressure to conform,What did Asch demonstrate that lack of unanimity greatly reduces the pressure to conform in?,0,Who demonstrated that lack of unanimity greatly reduces the pressure to conform in his classic studies of conformity?,1,What did Asch demonstrate that lack of unanimity greatly reduces in his classic studies of conformity?,0,,,,,,,,,,,,,,,,,,,
263,income taxes,provide the largest source of federal revenue,What provide the largest source of federal revenue?,1,What do income taxes provide the largest source of?,0,What do income taxes provide?,1,,,,,,,,,,,,,,,,,,,
264,an employer is forbidden to fire or discriminate against a worker who advocates thepossibility of unionizing under a provision of the,Wagner Act,Who is forbidden to fire or discriminate against a worker who advocates thepossibility of unionizing under a provision of the Wagner Act?,1,Who is an employer forbidden to fire or discriminate against?,1,Is an employer forbidden to fire or discriminate against a worker who advocates thepossibility of unionizing under a provision of the Wagner Act?,0,,,,,,,,,,,,,,,,,,,
265,a perfectly price-discriminating monopolist is able to,maximize profit and produce a level of output more consistent with optimal social well-being,Who is able to produce a level of output more consistent with optimal social well-being?,0,Who is able to maximize profit more consistent with optimal social well-being?,1,Is a perfectly price-discriminating monopolist able to maximize profit more consistent with optimal social well-being?,0,,,,,,,,,,,,,,,,,,,
266,creating the magic of consciousness is carried out primarily by,the forebrain,,0,,0,,0,,,,,,,,,,,,,,,,,,,
267,a major development in relations between the Soviet Union and the United States occurred in the late 1980 s when the two nations agreed to,eliminate a group of nuclear missiles,What occurred in the late 1980 s when the two nations agreed to eliminate a group of nuclear missiles?,1,What did a major development in relations between the Soviet Union and the United States occur in when the two nations agreed to eliminate a group of nuclear missiles?,0,,,,,,,,,,,,,,,,,,,,,
268,recession refers principally to,negative real GDP growth,What refers principally to negative real GDP growth?,1,What does recession refer principally to?,1,Does recession refer principally to negative real GDP growth?,0,,,,,,,,,,,,,,,,,,,
269,The new religion of Christianity appealed particularly to?,people with low status in the Roman Empire,What appealed particularly to?,0,Did the new religion of Christianity appeal particularly to?,0,,,,,,,,,,,,,,,,,,,,,
270,a nerve impulse is also called a(n),action potential,What is also called a action potential?,1,What is a nerve impulse also called?,1,Is a nerve impulse also called a action potential?,0,,,,,,,,,,,,,,,,,,,
271,In which stage of the business buying process is a supplier's task to make sure that the supplier is giving the buyer the expected satisfaction?,performance review,Whose task to make sure that the supplier is giving the buyer the expected satisfaction is buying process in which stage of the business?,0,What is a supplier's task to make sure that the supplier is giving the buyer the expected satisfaction in which stage of the business?,0,When is buying process a supplier's task to make sure that the supplier is giving the buyer the expected satisfaction?,0,,,,,,,,,,,,,,,,,,,
272,Hispanics comprise approximately what percent of the American population?,13 percent,Who comprise approximately what percent of the American population?,0,Do Hispanics comprise approximately what percent of the American population?,0,,,,,,,,,,,,,,,,,,,,,
273,microeconomics is the study of,"how households and firms make decisions, and how they interact in markets",What is the study of how households and firms make decisions?,1,What is the study of how households and firms interact in markets?,1,What is the study of how they interact in markets?,0,,,,,,,,,,,,,,,,,,,
274,"as a percentage of the total work force, federal government employment is",declining,What is declining as a percentage of the total work force?,1,What is federal government employment declining as?,0,Is federal government employment declining as a percentage of the total work force?,0,,,,,,,,,,,,,,,,,,,
275,"in Latin America, the deforestation of the Amazon rain forest has led to",environmental dangers,Where has the deforestation of the Amazon rain forest led to environmental dangers?,1,What has led to environmental dangers in Latin America?,1,What has the deforestation of the Amazon rain forest led to in Latin America?,1,,,,,,,,,,,,,,,,,,,
276,"either a constant growth rate of the money supply monetary rule, or a rule requiring the Fed to respond to changes in real GDP would reduce or eliminate",both the time inconsistency of monetary policy and the monetary portion of the political business cycle,,0,,0,,0,,,,,,,,,,,,,,,,,,,
277,"america's principal foreign policy strategy toward the Soviet Union throughout the Cold War,proposed by the foreign policy strategist George Kennan in 1947, was",containment,What was proposed by the foreign policy strategist George Kennan in 1947?,1,Who was the Cold War proposed by in 1947?,0,What was america's principal foreign policy strategy toward the Soviet Union throughout the Cold War?,1,,,,,,,,,,,,,,,,,,,
278,"samuelson and Solow reasoned that when aggregate demand was high, unemployment was","low, so there was upward pressure on wages and prices","What did samuelson and Solow reason that when aggregate demand was high, was low, so there was upward pressure on wages and prices?",0,"Who reasoned that when aggregate demand was high, unemployment was low, so there was upward pressure on wages and prices?",1,"What did samuelson and Solow reason that when aggregate demand was high, unemployment was low, so there was?",0,,,,,,,,,,,,,,,,,,,
279,economic mobility refers to the,movement of people among income classes,What does economic mobility refer to among income classes?,1,What refers to the movement of people among income classes?,1,What does economic mobility refer to the movement of people among?,0,,,,,,,,,,,,,,,,,,,
280,the presidential cabinet,"consists of the head of each executive department, plus any additional government officials the president designates","What consists of the head of each executive department, plus any additional government officials the president designates?",1,Who does the presidential cabinet consist of?,1,"Does the presidential cabinet consist of the head of each executive department, plus any additional government officials the president designates?",0,,,,,,,,,,,,,,,,,,,
281,"if the conditioned stimulus is presented many times without reinforcement, we can expect",extinction to occur,"If the conditioned stimulus is presented many times without reinforcement, who can expect extinction to occur?",0,"If the conditioned stimulus is presented many times without reinforcement, what can we expect to occur?",1,"If the conditioned stimulus is presented many times without reinforcement, can we expect extinction to occur?",0,,,,,,,,,,,,,,,,,,,
282,the study of culture primarily involves,learning why various peoples live as they do,What involves learning why various peoples live as they do?,1,What do?,0,Does the study of culture primarily involve learning why various peoples live as they do?,0,,,,,,,,,,,,,,,,,,,
283,The Crusades have been called  history s most successful failures.     Which statement best explains this expression?,"The Crusades did not achieve their original goals, but they brought about many desirable changes in Europe",When have the Crusades been called s most successful failures?,0,Who have been called history s most successful failures?,0,What have the Crusades been called history s?,1,,,,,,,,,,,,,,,,,,,
284,"the Suez Canal, the Panama Canal, and the Straits of the Dardanelles are similar because they",are strategic waterways that have been the center of conflicts,What are strategic waterways that have been the center of conflicts?,1,What are similar because they are strategic waterways that have been the center of conflicts?,0,What are the Suez Canal?,0,,,,,,,,,,,,,,,,,,,
285,during the 1980 s the governments of Libya and Iran were similar in that both were linked to,incidents of international terrorism,,0,,0,,0,,,,,,,,,,,,,,,,,,,
