,Objective Question,Original Answer,Sub Ques 1 ,Label 1,Sub Ques 2,Label 2,Sub Ques 3,Label 3,,,,,,,,,,,,,,,,,,,
0,"In China during the 1980s, government efforts to adapt Western economic ideas resulted in?",increased trade with many industrialized nations,Where did government efforts to adapt Western economic ideas result in?,0,What did government efforts to adapt Western economic ideas result in in?,1,What resulted in in China during the 1980s?,0,,,,,,,,,,,,,,,,,,,
1,Thomas Jefferson argued that the First Amendment created a   wall of separation   between,church and state,Who argued that the First Amendment created a wall of separation between church and state?,1,What did Thomas Jefferson argue that the First Amendment created a wall of?,1,What did Thomas Jefferson argue that the First Amendment created?,1,,,,,,,,,,,,,,,,,,,
2,"One similarity in the leadership of Latin Americas Jose de San Martin, Toussaint l Ouverture, Bernanrdo O Higgins, and Pedro I was that each leader",led a struggle to gain freedom for the people of his nation,Who was Toussaint l?,0,What was Jose de San Martin?,0,Was Jose de San Martin Toussaint l?,0,,,,,,,,,,,,,,,,,,,
3,The justification for separation from England in the Declaration of Independence was basedheavily on the ideas of the English philosopher,John Locke,What was basedheavily on the ideas of the English philosopher John Locke?,1,What was the justification for separation from England in the Declaration of Independence basedheavily on?,1,Was the justification for separation from England in the Declaration of Independence basedheavily on the ideas of the English philosopher John Locke?,0,,,,,,,,,,,,,,,,,,,
4,Studies have documented that the earnings gap between low-skill workers and high-skill workers has,increased over the past two decades,When have studies documented that the earnings gap between low-skill workers and high-skill workers has increased?,0,What have documented that the earnings gap between low-skill workers and high-skill workers has increased over the past two decades?,0,When have studies documented?,0,,,,,,,,,,,,,,,,,,,
5,"To assess clients' abilities, a phrenologist would want to",examine their skulls,Who would want to examine clients ' abilities's skulls?,0,What would a phrenologist want to examine?,1,Would a phrenologist want to examine clients ' abilities's skulls?,1,,,,,,,,,,,,,,,,,,,
6,"In the original constitutional system,",each presidential elector cast two ballots and the top vote-getter was named president and the runner-up became vice president,How many ballots and the top vote-getter did each presidential elector cast was named president in the original constitutional system?,0,Who cast the runner-up became vice president in the original constitutional system?,0,Who did each presidential elector cast the runner-up became in the original constitutional system?,0,,,,,,,,,,,,,,,,,,,
7,Which action best illustrates Mohandas Gandhi s concept of civil disobedience?,citizens in the United States went to jail for violation segregation laws,Who went to jail for violation segregation laws?,1,What did citizens in the United States go to?,0,What illustrates Mohandas Gandhi?,0,,,,,,,,,,,,,,,,,,,
8,hearing loss caused when the eardrums or ossicles are damaged by disease or injury is called,conduction deafness,What is hearing loss caused when the eardrums or ossicles are damaged by disease or injury called?,1,What is called conduction deafness?,1,Is hearing loss caused when the eardrums or ossicles are damaged by disease or injury called conduction deafness?,0,,,,,,,,,,,,,,,,,,,
9,the   gray liberation   movement refers to,those fighting for the rights of the elderly,What does the gray liberation movement refer to?,1,What refers to those fighting for the rights of the elderly?,1,Does the gray liberation movement refer to those fighting for the rights of the elderly?,0,,,,,,,,,,,,,,,,,,,
10,"according to monetarists, making too much money available to borrow may lead to",inflation,What may making too much money available to borrow lead to?,1,What may lead to inflation?,1,May making too much money available to borrow lead to inflation?,0,,,,,,,,,,,,,,,,,,,
11,one of the characteristics that all sensory systems have in common is,transduction,What is one of the characteristics that all sensory systems have in common?,0,What is transduction?,1,Is one of the characteristics that all sensory systems have in common transduction?,0,,,,,,,,,,,,,,,,,,,
12,"""I believe Amanda's anxiety and defensiveness are the result of an unrealistic self-image and an inability to take responsibility for her feelings."" This statement would most likely have been made by a",humanistic psychologist,What would most likely have been made by a humanistic psychologist?,0,Who would this statement most likely have been made by?,0,Would this statement most likely have been made by a humanistic psychologist?,0,,,,,,,,,,,,,,,,,,,
13,the surest way to alter human consciousness is,to administer a psychoactive drug,What is to administer a psychoactive drug?,0,Is the surest way to alter human consciousness to administer a psychoactive drug?,0,,,,,,,,,,,,,,,,,,,,,
14,"in a market economy, scarcity of resources is reflected in",prices,What is reflected in prices in a market economy?,1,What is scarcity of resources reflected in in a market economy?,0,What is scarcity of resources reflected in prices in?,0,,,,,,,,,,,,,,,,,,,
15,"in terms of organizational structure, American political parties are",decentralized and fragmented,What are decentralized and fragmented in terms of organizational structure?,1,What are american political parties decentralized and fragmented in?,1,Are american political parties decentralized and fragmented in terms of organizational structure?,0,,,,,,,,,,,,,,,,,,,
16,Rhodesia Becomes Zimbabwe    Gold Coast Becomes Ghana,reflect traditional cultures,What do Rhodesia Becomes Zimbabwe Gold Coast Becomes Ghana reflect?,0,What reflect traditional cultures?,0,Do Rhodesia Becomes Zimbabwe Gold Coast Becomes Ghana reflect traditional cultures?,0,,,,,,,,,,,,,,,,,,,
17,"The Treaty of Tordesillas (1494), concerning Latin America, and the Berlin Conference (1884-1885), concerning Africa, were similar in that each agreement",divided each area into European-controlled segments,What were similar in that each agreement divided each area into European-controlled segments?,1,"Who were concerning Latin America, and the Berlin Conference?",0,Who concerned Africa?,0,,,,,,,,,,,,,,,,,,,
18,The federal civil service was created by,the Pendleton Act,What was created by the Pendleton Act?,1,What was the federal civil service created by?,0,Was the federal civil service created by the Pendleton Act?,0,,,,,,,,,,,,,,,,,,,
19,Which is one major reason the Holocaust is considered a unique event in modern European history?,The genocide was planned in great detail and required the cooperation of many people,What is one major reason the Holocaust is considered a unique event in modern European history?,1,What was required the cooperation of many people?,0,What was the genocide required the cooperation of?,0,,,,,,,,,,,,,,,,,,,
20,Muslims consider the  Qur\'an  the greatest written work in Arabic mainly because it?,is believed to be the word of  Allah,Who consider the Qur ` an the greatest written work in Arabic mainly because it?,0,Who do Muslims consider mainly because it?,0,Do Muslims consider the Qur ` an the greatest written work in Arabic mainly because it?,0,,,,,,,,,,,,,,,,,,,
21,Divided government exists when,the major parties do not control both chambers of the state legislature and a majority of state elected officials,What exists when the major parties do not control both chambers of the state legislature and a majority of state elected officials?,1,Does divided government exist when the major parties do not control both chambers of the state legislature and a majority of state elected officials?,0,,,,,,,,,,,,,,,,,,,,,
22,"A child knows that when you take yellow paint and then mix in blue paint, you get green paint. When you ask her what color paint you get if you take blue paint and then mix in yellow paint, she doesn't know. Her thinking lacks",reversibility,"Who knows that when you take yellow paint and then mix in blue paint, you get green paint?",1,What lacks reversibility?,1,"What does a child know that when you take yellow paint and then mix in blue paint, you get?",0,,,,,,,,,,,,,,,,,,,
23,"In India, the Caste System determined a person s occupation, personal associations, and marriage partner.  This situation shows that the Caste system",has been a way of life as well as an element of religion,"Where did the Caste System determine a person s occupation, personal associations, and marriage partner?",1,"Who did the Caste System determine s occupation, personal associations, and marriage partner in India?",0,"What determined a person s occupation, personal associations, and marriage partner in India?",1,,,,,,,,,,,,,,,,,,,
24,An influence that spread from the Byzantine Empire to Early Russia was the,Orthodox Christian religion,What was an influence that spread from the Byzantine Empire to Early Russia?,1,What was the Orthodox Christian religion?,1,Was an influence that spread from the Byzantine Empire to Early Russia the Orthodox Christian religion?,0,,,,,,,,,,,,,,,,,,,
25,people in both Japan and India eat very little meat.  A study of these cultures would show that,"although these cultures have similar practices, the reasons for these practices differ",What do people in both Japan and India eat?,1,What eat very little meat?,0,What have similar practices?,0,,,,,,,,,,,,,,,,,,,
26,Which would represent the greatest loss to a professional wine taster or chef?,olfactory loss,What would represent the greatest loss to a professional wine taster or chef?,1,What would which represent to a professional wine taster or chef?,0,Who would which represent the greatest loss to?,0,,,,,,,,,,,,,,,,,,,
27,"the earliest survey studies of the effect of the media on public opinion, which evaluated itsimpact on voting behavior, offered",the minimal effects hypothesis,What offered the minimal effects hypothesis?,1,Did the earliest survey studies of the effect of the media on public opinion offer the minimal effects hypothesis?,0,,,,,,,,,,,,,,,,,,,,,
28,The rights of accused persons included in the Bill of Rights were originally intended to protectthe accused in,political arrests and trials,What were originally intended to protectthe accused in political arrests and trials?,1,Were the rights of accused persons included in the Bill of Rights originally intended to protectthe accused in political arrests and trials?,0,,,,,,,,,,,,,,,,,,,,,
29,Which statement about women under Islam is CORRECT?,women were expected to be modest and to obey their fathers or husbands,Who were expected to obey their fathers or husbands?,1,Who were expected to be modest?,1,Were women expected to obey their fathers or husbands?,0,,,,,,,,,,,,,,,,,,,
30,retreat from reality by hallucinations and delusions and by social withdrawal typically characterizes,psychotic disorders,,0,,0,,0,,,,,,,,,,,,,,,,,,,
31,the three techniques used for brainwashing identified by McConnell are,"isolation, dependency, and reward","How many techniques used for brainwashing identified by McConnell are isolation, dependency, and reward?",0,What are the three techniques used for brainwashing identified by McConnell?,1,"What are isolation, dependency, and reward?",1,,,,,,,,,,,,,,,,,,,
32,language is termed productive if it,is capable of generating new ideas and possibilities,What is termed productive if it is capable of generating new ideas and possibilities?,0,Is language termed productive if it is capable of generating new ideas and possibilities?,0,,,,,,,,,,,,,,,,,,,,,
33,"according to Gould, a ""crisis of questions, "" where an individual ponders the meaning of life, occurs during",early adulthood,"When does a ``crisis of questions,'' where an individual ponders the meaning of life, occur?",1,What occurs during early adulthood?,1,"Does a ``crisis of questions,'' where an individual ponders the meaning of life, occur during early adulthood?",0,,,,,,,,,,,,,,,,,,,
34,the relaxation of tensions between the United States and the Soviet Union throughout the1970s was known asÂ´,detente,What was the relaxation of tensions between the United States and the Soviet Union throughout the1970s known?,1,What was known asA detente?,1,Was the relaxation of tensions between the United States and the Soviet Union throughout the1970s known asA detente?,0,,,,,,,,,,,,,,,,,,,
35,the first and only place in which the idea of equality appears in the Constitution is in the,Fourteenth Amendment,What is in the Fourteenth Amendment?,1,What is the first and only place in which the idea of equality appears in the Constitution in?,0,Is the first and only place in which the idea of equality appears in the Constitution in the Fourteenth Amendment?,0,,,,,,,,,,,,,,,,,,,
36,goods and services produced and sold illegally are,excluded from GDP,What are excluded from GDP?,1,What are goods and services sold illegally excluded from?,1,What are goods and services produced excluded from?,0,,,,,,,,,,,,,,,,,,,
37,"In the 1930s, Manchuria became a symbol of Japan\'s?",desire for empire,When did Manchuria become a symbol of Japan's?,0,What became a symbol of Japan's in the 1930s?,1,What did Manchuria become a symbol of in the 1930s?,0,,,,,,,,,,,,,,,,,,,
38,"prior to the 1980 s, the emphasis of the Five-Year Plans in the Soviet Union was on heavy industry.  One result was the",scarcity of consumer goods,What was the emphasis of the Five-Year Plans in the Soviet Union on?,1,What was on heavy industry?,0,What was the scarcity of consumer goods?,0,,,,,,,,,,,,,,,,,,,
39,"to understand personality, trait theorists attempt to",classify traits and discover how they are related to behavior,Who attempt to discover how traits are related to behavior?,1,Who attempt to classify traits?,0,What do trait theorists attempt to classify?,1,,,,,,,,,,,,,,,,,,,
40,exorcism often involved,the use of physical torture,What torture?,0,Do exorcism often involved the use of physical torture?,0,,,,,,,,,,,,,,,,,,,,,
41,Colonial officials often discouraged native peoples from?,practicing traditional customs and rituals,Who often discouraged native peoples from?,0,What did Colonial officials often discourage from?,1,Did Colonial officials often discourage native peoples from?,0,,,,,,,,,,,,,,,,,,,
42,"the Magna Carta, the Glorious Revolution, and the writings of John Locke all contributed to Great Britain s development of",parliamentary democracy,"What does the Magna Carta, the Glorious Revolution, and the writings of John Locke all contributed to Great Britain s development of?",0,"What does the Magna Carta, the Glorious Revolution, and the writings of John Locke all contributed to Great Britain s?",1,What s development of parliamentary democracy?,0,,,,,,,,,,,,,,,,,,,
43,a supply curve slopes upward because,an increase in price gives producers incentive to supply a larger quantity,What slopes upward because an increase in price gives producers incentive to supply a larger quantity?,1,What gives producers incentive to supply a larger quantity?,1,Does a supply curve slope upward because an increase in price gives producers incentive to supply a larger quantity?,0,,,,,,,,,,,,,,,,,,,
44,"during the late 1980 s and early 1990 s, the Soviet Union experienced ethnic tensions that were most similar to those experienced by",Austria-Hungary in the late 19th century,What did the Soviet Union experience in the late 19th century during the late 1980 s and early 1990 s?,1,What experienced ethnic tensions that were most similar to those experienced by Austria-Hungary in the late 19th century during the late 1980 s and early 1990 s?,0,When did the Soviet Union experience ethnic tensions that were most similar to those experienced by Austria-Hungary during the late 1980 s and early 1990 s?,0,,,,,,,,,,,,,,,,,,,
45,Cash crops are important to most African countries because these crops?,can be sold abroad to bring money into the country,What are cash crops important to most African countries because?,0,Where are cash crops important because these crops?,0,What are important to most African countries because these crops?,0,,,,,,,,,,,,,,,,,,,
46,a good that is produced abroad and sold domestically is called,an import,What is a good that is produced abroad and sold domestically called?,1,What is called an import?,1,Is a good that is produced abroad and sold domestically called an import?,0,,,,,,,,,,,,,,,,,,,
47,"When the loss from a business-stealing externality exceeds the gain from a product-variety externality,",there are likely to be too many firms in a monopolistically competitive market,What exceeds the gain from a product-variety externality?,0,What does the loss from a business-stealing externality exceed?,0,Does the loss from a business-stealing externality exceed the gain from a product-variety externality?,0,,,,,,,,,,,,,,,,,,,
48,one similarity between the Five Pillars of Islam and the Ten Commandments is that both,provide a guide to proper ethical and moral behavior,Who is one similarity between the Five Pillars of Islam and the Ten Commandments that both provide?,0,What is that both provide a guide to proper ethical and moral behavior?,0,What is one similarity between the Five Pillars of Islam and the Ten Commandments?,1,,,,,,,,,,,,,,,,,,,
49,"three major ethical concerns of psychological researchers are deception, lasting harm to subjects, and",invasion of privacy,"How many major ethical concerns of psychological researchers are deception, lasting harm to subjects, and invasion of privacy?",0,"What are deception, lasting harm to subjects, and invasion of privacy?",1,What are three major ethical concerns of psychological researchers?,1,,,,,,,,,,,,,,,,,,,
50,the largest racial/ethnic minority group in the United States is,Hispanics,Who is the largest racial\/ethnic minority group in the United States?,1,What is Hispanics?,1,Is the largest racial\/ethnic minority group in the United States Hispanics?,0,,,,,,,,,,,,,,,,,,,
51,the first step in placing information into memory storage is,sensory memory,What is the first step in placing information into memory storage?,1,What is sensory memory?,1,Is the first step in placing information into memory storage sensory memory?,0,,,,,,,,,,,,,,,,,,,
52,americans believe strongly that,people should take personal responsibility for themselves,Who believe strongly that people should take personal responsibility for themselves?,1,Do americans believe strongly that people should take personal responsibility for themselves?,0,,,,,,,,,,,,,,,,,,,,,
53,the   power of the few   in the United States today is likely to refer to,technical experts,What is likely to refer to technical experts?,1,Is the power of the few in the United States today likely to refer to technical experts?,0,,,,,,,,,,,,,,,,,,,,,
54,a disadvantage of telephone public opinion surveys is,both B and C,What is a disadvantage of telephone public opinion surveys?,0,What is both B and C?,0,Is a disadvantage of telephone public opinion surveys both B and C?,0,,,,,,,,,,,,,,,,,,,
55,the conduction of a nerve impulse down the axon is called a(n),action potential,What is the conduction of a nerve impulse down the axon called?,1,What is called a action potential?,1,Is the conduction of a nerve impulse down the axon called a action potential?,0,,,,,,,,,,,,,,,,,,,
56,classical conditioning is most often used to condition,reflexes,What is most often used to condition reflexes?,1,What is classical conditioning most often used to?,0,Is classical conditioning most often used to condition reflexes?,0,,,,,,,,,,,,,,,,,,, 
57,Which is a linkage institution?,none of the above,,0,,0,,0,,,,,,,,,,,,,,,,,,,
58,"Currently, Diego Calabresa is employed by a firm that conducts marketing research and creates ads for other companies that help them target and promote their products to the right markets. Who is Diego's employer?",a marketing service agency,What is Diego Calabresa employed by?,0,What agency?,0,Who is employed by a firm that conducts marketing research and creates ads for other companies that help them target and promote their products to the right markets?,1,,,,,,,,,,,,,,,,,,,
59,What was the significance of the Annapolis meeting?,It issued the original call for the Constitutional Convention in Philadelphia,What issued the original call for the Constitutional Convention in Philadelphia?,1,Where did the significance of the Annapolis meeting issue the original call for the Constitutional Convention?,0,What did the significance of the Annapolis meeting issue in Philadelphia?,0,,,,,,,,,,,,,,,,,,,
60,an increase in expected inflation shifts the,short-run Phillips curve right,What shifts the short-run Phillips curve right?,1,What does an increase in expected inflation shift right?,0,Does an increase in expected inflation shift the short-run Phillips curve right?,0,,,,,,,,,,,,,,,,,,,
61,"the revolt in Hungary (1956), the demonstrations in Czechoslovakia (1968), and the formation of solidarity in Poland (1980 s) are similar in that they",represented a challenge to communist leadership,"What is the demonstrations in Czechoslovakia, and the formation of solidarity in Poland?",0,What are similar in that they represented a challenge to communist leadership?,1,What is Hungary?,0,,,,,,,,,,,,,,,,,,,
62,"if labor in Mexico is less productive than labor in the United States in all areas of production,",both nations can benefit from trade,"If labor in Mexico is less productive than labor in the United States in all areas of production, what can benefit from trade?",0,"If labor in Mexico is less productive than labor in the United States in all areas of production, what can both nations benefit from?",1,"If labor in Mexico is less productive than labor in the United States in all areas of production, can both nations benefit from trade?",0,,,,,,,,,,,,,,,,,,,
63,"if Diane receives an increase in her pay, we would expect Diane’s demand for",for normal goods to increase,"If Diane receives an increase in her pay, who would expect Diane's demand for for normal goods to increase?",0,"If Diane receives an increase in her pay, what would we expect to increase?",1,"If Diane receives an increase in her pay, whose demand for for normal goods would we expect to increase?",0,,,,,,,,,,,,,,,,,,,
64,"When we are studying the behavior of buyers, we are studying",demand,Who are we studying the behavior of?,0,Who are studying the behavior of buyers?,0,Who are studying demand?,0,,,,,,,,,,,,,,,,,,,
65,all subgovernments have the same goal,protecting their self-interest,Who have the same goal protecting their self-interest?,1,What do all subgovernments have?,0,Do all subgovernments have the same goal protecting their self-interest?,0,,,,,,,,,,,,,,,,,,,
66,difference thresholds,occur when we can detect the change in the intensity of a stimulus,What occur when we can detect the change in the intensity of a stimulus?,1,Do difference thresholds occur when we can detect the change in the intensity of a stimulus?,0,,,,,,,,,,,,,,,,,,,,,
67,"in India, the people have resisted changing their attitudes toward the caste system because",the Hindu beliefs of karma and dharma reinforce the caste system,Where have the people resisted changing their attitudes toward the caste system because the Hindu beliefs of karma and dharma reinforce the caste system?,1,What have the people resisted changing their attitudes toward the caste system because the Hindu beliefs of karma and dharma reinforce the caste system in?,0,What have resisted changing their attitudes toward the caste system because the Hindu beliefs of karma and dharma reinforce the caste system in India?,0,,,,,,,,,,,,,,,,,,,
68,an appreciation of the real exchange rate for the dollar,decreases the quantity of dollars demanded in the market for foreign-currency exchange,What does an appreciation of the real exchange rate for the dollar decrease?,1,What decreases the quantity of dollars demanded in the market for foreign-currency exchange?,1,What does an appreciation of the real exchange rate for the dollar decrease the quantity of?,0,,,,,,,,,,,,,,,,,,,
69,"the Koran, jihad, and the hegira are most closely associated with the practice of",Islam,What are most closely associated with the practice of Islam?,1,"What are the Koran, jihad, and the hegira most closely associated with?",1,"Are the Koran, jihad, and the hegira most closely associated with the practice of Islam?",0,,,,,,,,,,,,,,,,,,,
70,the expansion of communism into Eastern Europe was a direct result of,World War II,What was a direct result of World War II?,1,What was the expansion of communism into Eastern Europe?,0,What was the expansion of communism into Eastern Europe a direct result of?,1,,,,,,,,,,,,,,,,,,,
71,for the economy as a whole,income must equal expenditure,What must equal expenditure for the economy as a whole?,1,What must income equal for the economy as a whole?,1,What must income equal expenditure for?,0,,,,,,,,,,,,,,,,,,,
72,"suppose that the central bank must follow a rule that requires it to increase the money supply when the price level falls and decrease the money supply when the price level rises. If the economy starts from long-run equilibrium and aggregate supply shifts right, the central bank must","increase the money supply, which will move output further from its long-run level","If the economy starts from long-run equilibrium, what must increase the money supply?",0,"If the economy starts from long-run equilibrium, what must the central bank increase?",1,"If aggregate supply shifts right, what must increase the money supply?",0,,,,,,,,,,,,,,,,,,,
