Objective Question,Answer,Subjective Question #1,Label 1,Subjective Question #2,Label 2,Subjective Question #3,Label 3
three kilometres is equal to,3 000 metres,How many kilometres is equal to 3 000 metres?,1,What is equal to 3 000 metres?,0,What is three kilometres equal to?,0
the Right to Water in the Constitution implies,universal access to water,What does the Right to Water in the Constitution imply?,0,What implies universal access to water?,0,Does the Right to Water in the Constitution imply universal access to water?,0
sound is produced when objects,vibrate,What is produced when objects vibrate?,1,Is sound produced when objects vibrate?,0,,0
"impressed by the architecture of the adjoining sultanates, Vijayanagara rulers adopted the construction of",elephant stables,What did Vijayanagara rulers adopt the construction of?,1,What were impressed by the architecture of the adjoining sultanates?,0,What adopted the construction of elephant stables?,0
negative value of  rate of change of velocity of an object signifies,the velocity is decreasing,When does negative value of rate of change of velocity of an object signify is decreasing?,0,What signifies the velocity is decreasing?,0,What does negative value of rate of change of velocity of an object signify?,1
pathogens can enter our body through,"air, water and food","What can pathogens enter through air, water and food?",0,"What can enter our body through air, water and food?",1,What can pathogens enter our body through?,1
light can pass through a,straight hollow pipe,What can pass through a straight hollow pipe?,0,What can light pass through?,0,Can light pass through a straight hollow pipe?,0
"to find the north pole of a bar magnet, we",suspend it freely with the help of a thread,,0,,0,,0
the coal deposits in Ruhr region is an example of,actual resource,What is the coal deposits in Ruhr region?,0,What is the coal deposits in Ruhr region an example of?,1,What is an example of actual resource?,0
we can see partially through,a translucent object,Who can see partially through a translucent object?,0,What can we see partially through?,0,Can we see partially through a translucent object?,0
primary health center deals with,health education,What deals with health education?,0,What does primary health center deal with?,0,Does primary health center deal with health education?,0
"in order to detect the direction, navigators use a",magnetic compass,Who use a magnetic compass in order to detect the direction?,0,What do navigators use in order to detect the direction?,1,What do navigators use a magnetic compass in?,0
privatisation of health services had made it difficult for poor people to get good,health care,Who had made it difficult for poor people to get good health care?,0,What to get good health care?,0,Had privatisation of health services made it difficult for poor people to get good health care?,0
scraping the bark off trees by early man was done by,stone tools,,0,,0,,0
vedic age refers to the period of,aryans,What refers to the period of aryans?,0,When does vedic age refer?,0,Does vedic age refer to the period of aryans?,0
ebony is found in the areas of rainfall,more than 200 cm,What is found in the areas of rainfall more than 200 cm?,1,Where is ebony found?,0,What is ebony found in?,0
akbar designed his administration on the model laid down by the ruler,sher Shah Sur,Who designed his administration on the model laid down by the ruler sher Shah Sur?,1,What did akbar design on the model laid down by the ruler sher Shah Sur?,0,What did akbar design his administration on?,0
safety measures taken by the authorities to minimise the damage by cyclones in coastal areas include,"cyclone forecast and warning service with rapid communication of warnings,   arrangements to move people fast to safer place and   construction of cyclone shelters in cyclone prone areas",What are arrangements?,0,What are warnings?,0,Are warnings arrangements?,0
the leaves of thorny bushes grow in the form of,spines,What do the leaves of thorny bushes grow in?,0,What grow in the form of spines?,0,Do the leaves of thorny bushes grow in the form of spines?,0
a magnet remains unaffected in the presence of,a glass strip,What remains unaffected in the presence of a glass strip?,0,What does a magnet remain unaffected in?,1,Does a magnet remain unaffected in the presence of a glass strip?,0
"two years after the Kalinga war, Ashoka",inscribed his message on the Sarnath pillar,Who inscribed his message on the Sarnath pillar two years after the Kalinga war?,1,When did Ashoka inscribe his message on the Sarnath pillar?,1,What did Ashoka inscribe his message on two years after the Kalinga war?,0
female  Aedes  mosquito carries,dengue virus,What does female Aedes mosquito carry?,0,What carries dengue virus?,0,Does female Aedes mosquito carry dengue virus?,0
the administration of the Mauryan Empire was known from the book,arthashastra,What was the administration of the Mauryan Empire known from?,1,What was known from the book arthashastra?,0,Was the administration of the Mauryan Empire known from the book arthashastra?,0
our constitution ensures Universal Adult Franchise to all its,citizens,What ensures Universal Adult Franchise to all its citizens?,0,Who does our constitution ensure Universal Adult Franchise to?,1,Who does our constitution ensure to all its citizens?,0
the photosynthetic organ of a plant is its,leaf,What is the photosynthetic organ of a plant?,1,What is its leaf?,0,Is the photosynthetic organ of a plant its leaf?,0
"the term cell was coined by Robert Hooke, when he was examining under the microscope the slice of",cork,What was coined by Robert Hooke?,1,Who was the term cell coined by?,1,Was the term cell coined by Robert Hooke?,0
the water vapour in the atmosphere converts into water by,condensation process,What converts into water by condensation process?,0,What does the water vapor in the atmosphere convert into by condensation process?,1,What does the water vapor in the atmosphere convert into water by?,1
a judge of the Supreme Court can be removed through the process of,impeachment,What can a judge of the Supreme Court be removed through?,1,Who can be removed through the process of impeachment?,0,Can a judge of the Supreme Court be removed through the process of impeachment?,0
mangal Pandey attacked his officer in the cantonment of,barrackpore,Who attacked his officer in the cantonment of barrackpore?,1,What did mangal Pandey attack his officer in?,0,Who did mangal Pandey attack in the cantonment of barrackpore?,0
the Baiga tribe belonged to,central India,Where did the Baiga tribe belong?,0,What belonged to central India?,0,What did the Baiga tribe belong to?,1
the vegetation in the mountains varies with altitude. The coniferous trees are found at the altitude of,"1,500 m - 2,500 m","What are found at the altitude of 1,500 m- 2,500 m?",0,What does the vegetation in the mountains vary with?,1,What varies with altitude?,0
frictional force acts in the direction,opposite to the direction of motion,What acts in the direction opposite to the direction of motion?,0,What does frictional force act in the direction opposite to?,1,Does frictional force act in the direction opposite to the direction of motion?,0
desert plants have scale/spine-like leaves to,reduce the loss of water by transpiration,What have scale\/spine-like leaves to reduce the loss of water by transpiration?,0,What have desert plants scale\/spine-like leaves to reduce by transpiration?,0,What have desert plants scale\/spine-like leaves to reduce the loss of by transpiration?,0
our body is a ............... of electricity,conductor,,0,,0,,0
jupiter's red spot is actually a/an,big storm,What is jupiter's red spot actually a\/an?,0,What is actually a\/an big storm?,0,Is jupiter's red spot actually a\/an big storm?,0
all of the given are milk product except,chapati,What are milk product except chapati?,0,What are all of the given except chapati?,0,What are all of the given milk product except?,0
the Prime Minister and the Council of Ministers work on the principle of,collective responsibility,What do the Prime Minister and the Council of Ministers work on?,0,Who work on the principle of collective responsibility?,0,Do the Prime Minister and the Council of Ministers work on the principle of collective responsibility?,0
right to Water is a part of,right to Life,What is a part of right to Life?,0,What is right to Water a part of?,0,What is right to Water?,0
"in an electric torch, switch has a metal strip which can",slide to break or complete the circuit,What has a metal strip which can slide to break or complete the circuit in an electric torch?,0,What does switch have a metal strip which can slide to break or complete the circuit in?,0,What does switch have in an electric torch?,1
a protective diet must include,vitamins and minerals,What must include vitamins and minerals?,0,What must a protective diet include?,0,Must a protective diet include vitamins and minerals?,0
the filament of an electric bulb is made up of,thin conducting wire,What is made up of thin conducting wire?,0,Is the filament of an electric bulb made up of thin conducting wire?,0,,0
most of the beads that were found in Harappa were made of,carnelian,What were most of the beads that were found in Harappa made of?,0,What were made of carnelian?,0,Were most of the beads that were found in Harappa made of carnelian?,0
battery is having,two or more cells connected in such a way that the positive terminal of one cell is connected to the negative terminal of the next,How many cells connected in such a way that the positive terminal of one cell is connected to the negative terminal of the next is battery having?,1,What is battery having?,0,What is having two or more cells connected in such a way that the positive terminal of one cell is connected to the negative terminal of the next?,0
the wool fibre is straightened by the method called,combing,What is straightened by the method called combing?,0,What is the wool fiber straightened by?,1,Is the wool fiber straightened by the method called combing?,0
acid rain is caused due to the oxides of,nitrogen and sulphur,What is caused due to the oxides of nitrogen and sulphur?,1,What is acid rain caused due to?,1,Is acid rain caused due to the oxides of nitrogen and sulphur?,0
bats and dolphins can hear sounds of frequency,"upto 1,200 Hz and 1,500 Hz respectively","What can hear sounds of frequency upto 1,200 Hz and 1,500 Hz respectively?",0,"What can bats and dolphins hear sounds of 1,200 Hz and 1,500 Hz respectively?",1,What can bats and dolphins hear?,0
electric fuse contains wire that,can melt only on passage of electric current of high voltage,What contains wire that can melt only on passage of electric current of high voltage?,0,What does electric fuse contain?,1,Does electric fuse contain wire that can melt only on passage of electric current of high voltage?,0
nadir Shah was a ruler of,iran,Who was a ruler of iran?,0,What was nadir Shah a ruler of?,0,What was nadir Shah?,1
some substances can be obtained in pure state from their solutions by,crystallisation,What can be obtained in pure state from their solutions by crystallisation?,0,What can some substances be obtained in pure state from their solutions by?,0,What can some substances be obtained in from their solutions by crystallisation?,0
one centimeter is equal to,0.00001 km,What is equal to 0. 00001 km?,0,What is one centimeter equal to?,0,Is one centimeter equal to 0. 00001 km?,0
wood is an example of,radiator,What is an example of radiator?,1,What is wood an example of?,0,What is wood?,0
"on an average, at rest an adult human being breathes",15-18 times in a minute,When do at rest an adult human being breathes 15-18 times on an average?,0,What rest an adult human being breathes 15-18 times in a minute on an average?,0,What do at rest an adult human being breathes 15-18 times in a minute on?,0
the voice having a minimum frequency is that of a,a man,What is the voice having a minimum frequency?,0,Who is the voice having a minimum frequency that of?,0,What is that of a a man?,0
pEM is caused by the deficiency of,proteins and carbohydrates,What is caused by the deficiency of proteins and carbohydrates?,1,What is pEM caused by?,0,Is pEM caused by the deficiency of proteins and carbohydrates?,0
boiling point is the temperature at which,vapour pressure = atmospheric pressure,What is the temperature at which vapor pressure = atmospheric pressure?,1,What is boiling point?,0,Is boiling point the temperature at which vapor pressure = atmospheric pressure?,0
buddha and Mahavira belonged to,kshatriyas,Who belonged to kshatriyas?,0,Who did buddha and Mahavira belong to?,0,Did buddha and Mahavira belong to kshatriyas?,0
the difference between canopy and understorey is that,understorey is present below canopy,What is that understorey is present below canopy?,0,What is the difference between canopy and understorey that understorey is present below?,0,What is the difference between canopy and understorey below?,0
"by friction, we are unable to charge",a copper rod,Who are unable to charge a copper rod by friction?,0,What are we unable to charge a copper rod by?,0,Are we unable to charge a copper rod by friction?,0
doctors use,concave mirrors,Who use concave mirrors?,0,What do doctors use?,0,Do doctors use concave mirrors?,0
"during an earthquake, we should rush",out in an open field,Where should we rush out during an earthquake?,1,Who should rush out in an open field during an earthquake?,0,What should we rush out in an open field during?,0
marsilea belongs to,pteridophyta,What belongs to pteridophyta?,0,What does marsilea belong to?,1,Does marsilea belong to pteridophyta?,0
"three cotton bags contain coils of different metals. To find the bag that contains iron coil without touching, we can use",bar magnet,How many cotton bags contain coils of different metals?,1,What contain coils of different metals?,0,What do three cotton bags contain coils of?,1
non-stick cookwares have the coating of,teflon,What do non-stick cookwares have the coating of?,0,What have the coating of teflon?,0,What do non-stick cookwares have?,0
air moves from the region where the air pressure is high to the region where,the pressure is low,What moves from the region where the air pressure is high to the region where the pressure is low?,0,Does air move from the region where the air pressure is high to the region where the pressure is low?,0,What does air move from?,0
regions where growth takes place in plants have,meristem,What do regions where growth takes place in plants have?,1,Do regions where growth takes place in plants have meristem?,0,What have meristem?,0
mark the correct consequence of relocation of factories,issues regarding the safety conditions of the workers remain unaddressed,,0,,0,,0
a mixture of iron filings and sulphur powder can be separated by using,a solution of carbon disulphide,What can be separated by using a solution of carbon disulphide?,0,Can a mixture of iron filings and sulphur powder be separated by using a solution of carbon disulphide?,0,,0
ten kilometres is equal to,10 00 000 centimetres,What is ten kilometres equal to?,0,What is equal to 10 00 000 centimetres?,0,Is ten kilometres equal to 10 00 000 centimetres?,0
natural fibres are obtained from    i. Wool   ii. Silk   iii. Polyester    iv. Linen   Select the correct answer using the code given below,"i, ii and iv only",,0,,0,,0
the Khilafat Issue was related to the Islam community of,ottoman Turkey,What was related to the Islam community of ottoman Turkey?,0,What was the Khilafat Issue related to?,1,Was the Khilafat Issue related to the Islam community of ottoman Turkey?,0
rani Laxmibai wanted the company to recognise her,adopted son,Who did Rani Laxmibai want the company to recognize?,0,What did Rani Laxmibai want to recognize her adopted son?,0,Who wanted the company to recognize her adopted son?,0
during inhalation,diaphragm moves down and rib cage moves outward,,0,,0,,0
"in the Rig Vedic time, the God Agni was the God of",fire,Who was the God of fire in the Rig Vedic time?,1,When was the God Agni the God of fire?,0,Who was the God Agni in the Rig Vedic time?,0
the Civil Rights Movement took place,u.S.A,What did the Civil Rights Movement take place u. S.?,0,What did the Civil Rights Movement take u. S. A?,0,What took place u. S. A?,0
earth’s distance from the Sun,varies throughout the year,When does earth's distance from the Sun vary?,0,What varies throughout the year?,0,Does earth's distance from the Sun vary throughout the year?,0
the primary function of photosynthesis is to convert,light energy into chemical energy,What is to convert light energy into chemical energy?,0,Is the primary function of photosynthesis to convert light energy into chemical energy?,0,,0
rusting of iron takes place in the presence of moisture and,oxygen,What takes place in the presence of moisture and oxygen?,0,What does rusting of iron take place in?,0,What does rusting of iron take in the presence of moisture and oxygen?,0
the Bakarwals belonged to,kashmir,Where did the Bakarwals belong?,1,Who belonged to kashmir?,0,What did the Bakarwals belong to?,0
the cells of the cork of the older plants have deposits of,suberin,What have deposits of suberin?,0,What do the cells of the cork of the older plants have?,0,What do the cells of the cork of the older plants have deposits of?,1
global climate witnessed change around,"12,000 years ago","What witnessed change around 12,000 years ago?",0,"Do global climate witness change around 12,000 years ago?",0,,0
rate of diffusion will be negligble when,sodium chloride and ammonium chloride are mixed,When will be negligble when sodium chloride and ammonium chloride are mixed?,0,Will rate of diffusion be negligble when sodium chloride and ammonium chloride are mixed?,0,,0
pressure flaking is one of the technique of,tool making,What is one of the technique of tool making?,1,What is pressure flaking one of?,0,What is pressure flaking?,1
a coconut tree is useful because it,provides oil,What is useful because it provides oil?,0,What does a coconut tree provide?,1,What provides oil?,0
diabetes is caused due to decreased secretion of,insulin,What is caused due to decreased secretion of insulin?,1,What is diabetes caused due to?,0,Is diabetes caused due to decreased secretion of insulin?,0
the filament of an electric bulb glows on passage of current,due to the heating effect of an electric current,What glows on passage of current due to the heating effect of an electric current?,0,What does the filament of an electric bulb glow on?,0,Does the filament of an electric bulb glow on passage of current due to the heating effect of an electric current?,0
"to relieve indigestion, we take an antacid such as milk of magnesia, which contains",magnesium hydroxide,What contains magnesium hydroxide?,0,What does magnesia contain?,0,Does magnesia contain magnesium hydroxide?,0
the UN Security Council has,fifteen members,Who does the UN Security Council have?,0,What has fifteen members?,0,Does the UN Security Council have fifteen members?,0
the Mauryan Empire was founded more than,"2,300 years ago","What was founded more than 2,300 years ago?",0,"Was the Mauryan Empire founded more than 2,300 years ago?",0,,0
the different types of weather patterns that we normally observe are      i. Sunny      ii. Tropical      iii. Cloudy      iv. Rainy,"i, iii and iv only",,0,,0,,0
cities developed on the bank of the Ganga around,2500 year ago,What developed on the bank of the Ganga around 2500 year ago?,1,What did cities develop on around 2500 year ago?,0,Did cities develop on the bank of the Ganga around 2500 year ago?,0
strongest forces of attraction exists between the particles of,copper,What does strongest forces of attraction exist between?,0,What exists between the particles of copper?,1,Does strongest forces of attraction exist between the particles of copper?,0
in acidic solution china rose indicator turns to,magenta,What rose indicator turns to magenta in acidic solution?,0,What did china rise to magenta in acidic solution?,0,What did china rise indicator turns to in acidic solution?,0
the use of the Lahore Gate Improvement Scheme for the residents of old Walled City of Delhi was to,draw them out to new areas,What was to draw them out to new areas?,0,Was the use of the Lahore Gate Improvement Scheme for the residents of old Walled City of Delhi to draw them out to new areas?,0,,0
mark the term used for fair and just trial,impartial judgment,,0,,0,,0
saline water supports,mangrove forests,What supports mangrove forests?,0,What does saline water support?,0,Does saline water support mangrove forests?,0
pulmonary vein carries,oxygen rich blood,What carries oxygen rich blood?,1,What does pulmonary vein carry?,1,Does pulmonary vein carry oxygen rich blood?,0
scientific concept of work suggest that work is said to be done if,application of force on a body that displaces it,What suggest that work is said to be done if application of force on a body that displaces it?,0,Do scientific concept of work suggest that work is said to be done if application of force on a body that displaces it?,0,What do scientific concept of work suggest?,1
the endomembrane system of the cell includes,endoplasmic reticulum,What does the endomembrane system of the cell include?,1,What includes endoplasmic reticulum?,0,Does the endomembrane system of the cell include endoplasmic reticulum?,0
occurrence of lightning is an example of,fast change,What is occurrence of lightning an example of?,0,What is an example of fast change?,1,What is occurrence of lightning?,0
"if two ends of a wire are dipped in orange juice, then a compass needle brought near the circuit",shows deflection,"If two ends of a wire are dipped in orange juice, what shows deflection?",0,"If two ends of a wire are dipped in orange juice, what does then a compass needle brought near the circuit show?",1,"If two ends of a wire are dipped in orange juice, does then a compass needle brought near the circuit show deflection?",0
atoms of different elements have,different masses and different chemical properties,What have different masses and different chemical properties?,0,What do atoms of different elements have?,1,Do atoms of different elements have different masses and different chemical properties?,0
an appropriate distance between the seeds is essential to avoid,overcrowding,What is essential to avoid overcrowding?,0,Is an appropriate distance between the seeds essential to avoid overcrowding?,0,,0
isotopes of an element have,same atomic number but different mass number,What do isotopes of an element have?,1,What have same atomic number but different mass number?,1,Do isotopes of an element have same atomic number but different mass number?,0
the Article 21 of the Constitution includes the right to enjoyment of pollution free,water and air,What does the Article 21 of the Constitution include?,1,What includes the right to enjoyment of pollution free water and air?,1,Does the Article 21 of the Constitution include the right to enjoyment of pollution free water and air?,0
people participate in the government decisions by,analysing the government policies,,0,,0,,0
loud and soft sound can have the same,frequency,What can have the same frequency?,0,What can loud and soft sound have?,1,Can loud and soft sound have the same frequency?,0
the judges of the Supreme Court retire at the age of,65,What do the judges of the Supreme Court retire at?,0,Who retire at the age of 65?,0,Do the judges of the Supreme Court retire at the age of 65?,0
yellow yolk of egg represents,single cell,What does yellow yolk of egg represent?,1,What represents single cell?,0,Does yellow yolk of egg represent single cell?,0
the Supreme Court of India was established on,"26th January,1950",When was the Supreme Court of India established on 26th?,0,"What was established on 26th January, 1950?",0,"Was the Supreme Court of India established on 26th January, 1950?",0
temperature of –200°C is equal to,73 K,What is temperature of 200C equal to K?,0,What is equal to 73 K?,0,Is temperature of 200C equal to 73 K?,0
ron is standing in the middle of a field with a compass. The red portion of the compass needle is pointing away from him. He wants to go towards east then he should,turn right and walk straight,Where is ron standing with a compass?,0,What is ron standing in with a compass?,0,What is standing in the middle of a field with a compass?,0
increase in the sea level happens due to increased,carbon dioxide in the atmosphere,What happens due to increased carbon dioxide in the atmosphere?,0,What does increase in the sea level happen due to?,0,Does increase in the sea level happen due to increased carbon dioxide in the atmosphere?,0
different tissues join to form a,organ,What join to form a organ?,1,What do different tissues join to form?,1,Do different tissues join to form a organ?,0
cO₂ can be produced by –,sodium bicarbonate (baking soda) and Potassium bicarbonate,What can be produced by sodium bicarbonate and Potassium bicarbonate?,1,What can cO be produced by?,0,Can cO be produced by sodium bicarbonate and Potassium bicarbonate?,0
maximum temperature of the day normally occurs,in the afternoon,When does maximum temperature of the day normally occur?,1,What normally occurs in the afternoon?,0,Does maximum temperature of the day normally occur in the afternoon?,0
the part of sugarcane plant from which sugar is obtained is its,stem,What is the part of sugarcane plant from which sugar is obtained?,1,What is its stem?,0,Is the part of sugarcane plant from which sugar is obtained its stem?,0
